Workflow Comparison Score,Total Agents Compared
76%,3

Agent Name,Agent Score,Risk Level,Key Score Drivers,Migration Action Required
DI BigQuery Gold Dim Transformation Recommender,73%,Medium,"role/goal/backstory removed, model changed from gemini-2.5-pro to gpt-4.1, GitHub tools removed",Validate new model behavior and confirm instruction field removal
DI BigQuery Gold Dim Transformation Data Mapping,78%,Medium,"role/goal/backstory removed, model changed from gemini-2.5-pro to gpt-4.1, GitHub tools removed",Validate new model behavior and confirm instruction field removal
DI BigQuery Gold Data Mapping Reviewer,77%,Medium,"role/goal/backstory removed, model changed from gemini-2.5-pro to gpt-4.1, GitHub tools removed",Validate new model behavior and confirm instruction field removal