Workflow Comparison Score,Total Agents Compared
73%,3

Agent Name,Agent Score,Risk Level,Key Score Drivers,Migration Action Required
DI BigQuery Gold Dim Transformation Recommender,75%,Medium,"role/goal/backstory removed, model changed from gemini-2.5-pro to gpt-4.1, allowDelegation changed",Validate new model performance and confirm instruction field removal
DI BigQuery Gold Dim Transformation Data Mapping,75%,Medium,"role/goal/backstory removed, model changed from gemini-2.5-pro to gpt-4.1, allowDelegation changed",Validate new model performance and confirm instruction field removal
DI BigQuery Gold Data Mapping Reviewer,75%,Medium,"role/goal/backstory removed, model changed from gemini-2.5-pro to gpt-4.1, allowDelegation changed",Validate new model performance and confirm instruction field removal