Workflow Comparison Score,Total Agents Compared
76%,3

Agent Name,Agent Score,Risk Level,Key Score Drivers,Migration Action Required
DI Databricks Gold Dim Transformation Recommender,72%,Medium,"model changed from anthropic.claude-4-sonnet to model, maxIter/maxRpm removed, role/goal/backstory removed",Validate model compatibility and runtime behavior
DI Databricks Gold Dim Transformation Data Mapping,76%,Medium,"model changed, embedding configs removed, maxIter/maxRpm removed, role/goal/backstory removed",Validate model compatibility and embedding functionality
DI Databricks Gold Data Mapping Reviewer,80%,Medium,"model changed, maxIter/maxRpm removed, role/goal/backstory removed",Validate model compatibility and runtime behavior