Workflow Comparison Score,Total Agents Compared
78%,4

Agent Name,Agent Score,Risk Level,Key Score Drivers,Migration Action Required
DI_Databricks_Bronze_Model_Logical,85%,Low,Model configs matched but name normalized,Validate naming convention
DI_Databricks_Bronze_Model_Physical,75%,Medium,Model deployment changed from Anthropic to GPT,Validate model compatibility
DI_Databricks_Bronze_Model_Data_Mapping,72%,Medium,Model deployment changed and maxRpm removed,Update runtime configurations
DI_Databricks_Bronze_Model_Reviewer,80%,Low,Model deployment changed but core configs preserved,Validate model performance