Workflow Comparison Score,Total Agents Compared
78.5%,4

Agent Name,Agent Score,Risk Level,Key Score Drivers,Migration Action Required
DI Databricks Bronze Model Logical,85%,Medium,Model changed from Anthropic to GPT-4.1; maxIter/maxRpm removed; role/goal/backstory removed,Validate model behavior and add missing instruction fields
DI Databricks Bronze Model Physical,82%,Medium,Model changed from Anthropic to GPT-4.1; maxIter/maxRpm removed; role/goal/backstory removed,Validate model behavior and add missing instruction fields
DI Databricks Bronze Model Data Mapping,82%,Medium,Model changed from Anthropic to GPT-4.1; maxIter/maxRpm removed; role/goal/backstory removed,Validate model behavior and add missing instruction fields
DI Databricks Bronze Model Reviewer,65%,Medium,Model changed from Anthropic to GPT-4.1; maxIter/maxRpm removed; role/goal/backstory removed,Validate model behavior and add missing instruction fields