Workflow Comparison Score,Total Agents Compared
76%,3

Agent Name,Agent Score,Risk Level,Key Score Drivers,Migration Action Required
DI Azure Synapse To Bigquery Documentation,72%,Medium,"Model changed from claude-4-sonnet to gpt-4.1, maxExecutionTime reduced, role/goal/backstory removed",Validate model compatibility and runtime behavior
DI Azure Synapse To Bigquery Analyzer,78%,Medium,"Model changed from claude-4-sonnet to gpt-4.1, maxExecutionTime reduced, role/goal/backstory removed",Validate model compatibility and runtime behavior
DI Azure Synapse To Bigquery Plan,80%,Medium,"Model changed from claude-4-sonnet to gpt-4.1, maxExecutionTime reduced, role/goal/backstory removed, maxIter changed from 3 to null",Validate model compatibility and runtime behavior