Workflow Comparison Score,Total Agents Compared
76,3

Agent Name,Agent Score,Risk Level,Key Score Drivers,Migration Action Required
DI_ECL_Documentation_JSON vs DI ECL Documentation,85,Medium,"Model changed (gpt-4o to gpt-4.1), role/goal/backstory removed, description modified","Validate model compatibility and confirm instruction field removal"
DI_ECL_To_JavaSpringboot_Analyzer_Json vs DI ECL To JavaSpringboot Analyzer,72,Medium,"Model changed, description significantly modified, name normalized","Review description changes and validate model behavior"
DI_ECL_To_JavaSpringboot_Plan_JSON vs DI ECL To JavaSpringboot Plan,71,Medium,"Model changed, description modified, name normalized","Validate model compatibility and review instruction changes"