Workflow Comparison Score,Total Agents Compared
87%,3

Agent Name,Agent Score,Risk Level,Key Score Drivers,Migration Action Required
Snowflake to PySpark Documentation,85%,Medium,"Model changed (gpt-4o to gpt-4.1), role/goal/backstory removed, maxExecutionTime added","Validate model compatibility and confirm instruction field removal"
Snowflake to PySpark Analysis,89%,Medium,"Model changed (gpt-4o to gpt-4.1), role/goal/backstory removed, maxExecutionTime added","Validate model compatibility and confirm instruction field removal"
Snowflake to PySpark Plan,87%,Medium,"Model changed (gpt-4o to gpt-4.1), role/goal/backstory removed, maxExecutionTime added","Validate model compatibility and confirm instruction field removal"