Workflow Comparison Score,Total Agents Compared
84%,5

Agent Name,Agent Score,Risk Level,Key Score Drivers,Migration Action Required
DB2 TO SYNAPSE CONVERTER,88%,Low,Model changed from claude-3.7sonnet to gpt-4.1; role/goal/backstory removed; description matched,Validate new model behavior and confirm instruction field removal
DB2 to SYNAPSE Unit Testing,92%,Low,Model changed from gpt-4o to gpt-4.1; name normalized; description matched,Validate new model behavior
DB2 To SYNAPSE Conversion Tester,92%,Low,Model changed from gpt-4o to gpt-4.1; name normalized; description matched,Validate new model behavior
DB2 To SYNAPSE Reconciliation,92%,Low,Model changed from gpt-4o to gpt-4.1; name normalized; description matched,Validate new model behavior
DB2 TO SYNAPSE REVIEWER,92%,Low,Model changed from gpt-4o to gpt-4.1; description matched,Validate new model behavior