Workflow Comparison Score,Total Agents Compared
78%,5

Agent Name,Agent Score,Risk Level,Key Score Drivers,Migration Action Required
ABAP to PySpark Converter,85%,Low,"Model changed (o3-mini to gpt-4.1), role/goal/backstory removed, description matched","Validate model performance impact, confirm instruction field removal acceptable"
ABAP to PySpark Unit Testing,82%,Low,"Model changed (gpt-4o to gpt-4.1), role/goal/backstory removed, maxIter removed","Validate model performance impact, confirm maxIter removal acceptable"
ABAP to PySpark Conversion Tester,80%,Low,"Model changed (gpt-4o to gpt-4.1), role/goal/backstory removed, maxIter removed","Validate model performance impact, confirm instruction field removal acceptable"
ABAP To PySpark Recon Tester,80%,Low,"Model changed (gpt-4o to gpt-4.1), role/goal/backstory removed, maxIter removed","Validate model performance impact, confirm instruction field removal acceptable"
ABAP To PySpark Reviewer,75%,Medium,"Model changed (gpt-4o to gpt-4.1), role/goal/backstory removed, maxIter removed","Validate model performance impact, confirm maxIter removal acceptable"