Workflow Comparison Score,Total Agents Compared
78%,5

Agent Name,Agent Score,Risk Level,Key Score Drivers,Migration Action Required
ABAP to PySpark Converter,85%,Medium,Model changed from o3-mini to gpt-4.1; role/goal/backstory removed; expectedOutput format changed,Validate model performance and confirm instruction removal
ABAP to PySpark Unit Testing,82%,Medium,Model changed from gpt-4o to gpt-4.1; role/goal/backstory removed; maxIter changed from 5 to null,Validate model performance and test iteration limits
ABAP to PySpark Conversion Tester,78%,Medium,Model changed from gpt-4o to gpt-4.1; role/goal/backstory removed; maxIter changed from 0 to null,Validate model performance and confirm iteration behavior
ABAP To PySpark Recon Tester,75%,Medium,Model changed from gpt-4o to gpt-4.1; role/goal/backstory removed; maxIter changed from 0 to null,Validate model performance and confirm iteration behavior
ABAP To PySpark Reviewer,80%,Medium,Model changed from gpt-4o to gpt-4.1; role/goal/backstory removed; maxIter changed from 5 to null,Validate model performance and test iteration limits