Workflow Comparison Score,Total Agents Compared
87%,5

Agent Name,Agent Score,Risk Level,Key Score Drivers,Migration Action Required
DI SSIS to PySpark Converter,92%,Low,"model configs matched, description matched, LLM settings preserved",Validate naming convention change
DI SSIS to PySpark Unit Tester,88%,Medium,"core configs matched, topP slightly modified, role/goal/backstory removed",Confirm instruction field removal acceptable
DI SSIS to PySpark Conversion Tester,88%,Medium,"core configs matched, topP slightly modified, role/goal/backstory removed",Confirm instruction field removal acceptable
DI SSIS To PySpark Recon Tester,80%,Medium,"maxIter/maxRpm/maxExecutionTime set to null, role/goal/backstory removed",Validate runtime parameter changes
DI SSIS To PySpark Reviewer,88%,Medium,"core configs matched, topP slightly modified, role/goal/backstory removed",Confirm instruction field removal acceptable