Workflow Comparison Score,Total Agents Compared
78%,3

Agent Name,Agent Score,Risk Level,Key Score Drivers,Migration Action Required
DI DataStage Documentation,85%,Low,"Model configs matched, temperature matched, maxExecutionTime reduced",Validate reduced execution time impact
DI DataStage To DBT Analyzer,72%,Medium,"Model configs matched, role/goal/backstory removed, maxExecutionTime reduced",Confirm instruction field removal acceptable
DI DataStage To DBT Plan,78%,Medium,"Model configs matched, role/goal/backstory removed, maxExecutionTime reduced",Confirm instruction field removal acceptable