Workflow Comparison Score,Total Agents Compared
76%,3

Agent Name,Agent Score,Risk Level,Key Score Drivers,Migration Action Required
DI SQL Server To Snowflake Documentation,78%,Medium,"role/goal/backstory removed, description matched, LLM configs matched","Validate removal of role/goal/backstory fields acceptable"
DI SQL Server To Snowflake Analyzer,76%,Medium,"role/goal/backstory removed, description matched, LLM configs matched","Validate removal of role/goal/backstory fields acceptable"
DI SQL Server To Snowflake Plan,74%,Medium,"role/goal/backstory removed, description matched, LLM configs matched","Validate removal of role/goal/backstory fields acceptable"