Workflow Comparison Score,Total Agents Compared
88%,5

Agent Name,Agent Score,Risk Level,Key Score Drivers,Migration Action Required
DI_AbInitio_To_PySpark_EMR_Glue_Converter,92%,Low,"model configs matched, description matched, temperature matched",None
DI_AbInitio_To_PySpark_EMR_Glue_Unit_Tester,89%,Low,"description matched, model configs matched, minor field removals",Validate removed fields impact
DI_AbInitio_To_PySpark_EMR_Glue_Conversion_Tester,87%,Low,"description matched, model configs matched, minor field removals",Validate removed fields impact
DI_AbInitio_To_PySpark_EMR_Glue_Recon_Tester,85%,Low,"description masked, model configs matched, minor field removals",Validate masked content and removed fields
DI_AbInitio_To_PySpark_EMR_Glue_Reviewer,88%,Low,"description matched, model configs matched, minor field removals",Validate removed fields impact