Workflow Comparison Score,Total Agents Compared
88%,5

Agent Name,Agent Score,Risk Level,Key Score Drivers,Migration Action Required
DI_AbInitio_To_PySpark_EMR_Glue_Converter,85%,Medium,role/goal/backstory removed; model config changed,Validate instruction completeness and model behavior
DI_AbInitio_To_PySpark_EMR_Glue_Unit_Tester,92%,Low,description matched; model config preserved,None
DI_AbInitio_To_PySpark_EMR_Glue_Conversion_Tester,92%,Low,description matched; model config preserved,None
DI_AbInitio_To_PySpark_EMR_Glue_Recon_Tester,92%,Low,description matched; model config preserved,None
DI_AbInitio_To_PySpark_EMR_Glue_Reviewer,88%,Medium,description modified; model config changed,Validate instruction accuracy and model behavior