Workflow Comparison Score,Total Agents Compared
87.2,5

Agent Name,Agent Score,Risk Level,Key Score Drivers,Migration Action Required
DI_AbInitio_To_PySpark_EMR_Glue_Converter,88.5,Low,Description matched; model configs changed; role/goal/backstory removed,Validate new model deployment and confirm instruction field removal
DI_AbInitio_To_PySpark_EMR_Glue_Unit_Tester,89.2,Low,Description matched; model configs changed; role/goal/backstory removed,Validate new model deployment and confirm instruction field removal
DI_AbInitio_To_PySpark_EMR_Glue_Conversion_Tester,89.2,Low,Description matched; model configs changed; role/goal/backstory removed,Validate new model deployment and confirm instruction field removal
DI_AbInitio_To_PySpark_EMR_Glue_Recon_Tester,84.0,Medium,Description masked; model configs changed; role/goal/backstory removed,Unmask description and validate new model deployment
DI_AbInitio_To_PySpark_EMR_Glue_Reviewer,85.8,Medium,Description modified; model configs changed; role/goal/backstory removed,Validate description changes and new model deployment