section,category,entity,sub_entity,attribute,description,impact,DI_MarkLogic_to_MongoDB_DocAnalyze.json_ref,DI_MarkLogic_to_MongoDB_Doc&Analyze.json_ref
summary,overall_score,workflow,,,72,
summary,semantic_similarity,workflow,,,88,
summary,structural_similarity,workflow,,,45,
summary,governance_quality,workflow,,,65,
summary,migration_readiness,workflow,,,Requires comprehensive structural migration with moderate risk,
scoring,semantic_similarity,workflow,,,High semantic preservation across all agents with consistent core functionality,
scoring,structural_similarity,workflow,,,Major breaking reorganization with complete container restructuring,
scoring,governance_quality,workflow,,,Significant loss of expectedOutput constraints and task structure,
scoring,overall,workflow,,,Balanced by strong semantic preservation despite structural breaking changes,
deduction,executive_summary,workflow,,,AAVA 2.0 introduces major structural reorganization while preserving core agent semantics and upgrading models,High migration effort required with moderate execution risk
deduction,executive_summary,workflow,,,Complete workflow container restructuring from nodes to workflowAgents with new identification schema,Breaking changes require coordinated migration
deduction,executive_summary,workflow,,,All agents maintain semantic consistency but lose explicit output validation constraints,Governance enforcement degradation
deduction,executive_summary,workflow,,,Model upgrades from gpt-4o to gpt-4.1 across all agents may introduce behavioral variance,Potential execution differences
deduction,structural_analysis,workflow,,workflowId,Workflow identifier changed from root workflowId (1050) to nested workFlowDetail.id (2624),Breaking path change requiring orchestration updates,workflowId,workFlowDetail.id
deduction,structural_analysis,workflow,,workflowName,Workflow name moved from root workflowName to nested workFlowDetail.name,Breaking path change,workflowName,workFlowDetail.name
deduction,schema_evolution,workflow,,nodes,Root nodes array completely replaced with workflowAgents array,Major container restructuring requiring agent remapping,nodes,workflowAgents
deduction,structural_analysis,workflow,,container,Complete workflow container restructuring from flat to nested workFlowDetail structure,Breaking architectural change
deduction,agent_renamed,agent,MarkLogic_Documentation,agentName,Agent MarkLogic_Documentation renamed to MarkLogic Documentation with preserved semantic role,Low semantic risk but identifier change,MarkLogic_Documentation,MarkLogic Documentation
deduction,agent_renamed,agent,MarkLogic_to_MongDB_Analyzer,agentName,Agent MarkLogic_to_MongDB_Analyzer renamed to MarkLogic to MongDB Analyzer with preserved semantic role,Low semantic risk but identifier change,MarkLogic_to_MongDB_Analyzer,MarkLogic to MongDB Analyzer
deduction,agent_renamed,agent,MarkLogic_to_MongDB_Plan,agentName,Agent MarkLogic_to_MongDB_Plan renamed to MarkLogic to MongDB Plan with preserved semantic role,Low semantic risk but identifier change,MarkLogic_to_MongDB_Plan,MarkLogic to MongDB Plan
deduction,field_change,agent,MarkLogic Documentation,agentName,agentName field renamed to name,Minor structural change,agentName,name
deduction,field_change,agent,MarkLogic Documentation,agentId,New agentId field (7351) added for unique identification,Enhanced identification capability,,agentId
deduction,field_change,agent,MarkLogic Documentation,model,model field renamed to modelDeploymentName,Structural rename with semantic preservation,model,modelDeploymentName
deduction,field_change,agent,MarkLogic Documentation,model,Model upgraded from gpt-4o to gpt-4.1,Potential behavioral variance in agent responses,gpt-4o,gpt-4.1
deduction,field_change,agent,MarkLogic Documentation,tools,tools array renamed to toolReferences,Low risk structural rename,tools,toolReferences
deduction,structural_analysis,agent,MarkLogic Documentation,task,Complete task object structure flattened into description field,Major structural simplification with potential metadata loss,task,description
deduction,missing_metadata,agent,MarkLogic Documentation,expectedOutput,expectedOutput specification completely removed,Loss of validation enforcement and output contracts,expectedOutput,
deduction,field_change,agent,MarkLogic to MongDB Analyzer,agentName,agentName field renamed to name,Minor structural change,agentName,name
deduction,field_change,agent,MarkLogic to MongDB Analyzer,agentId,New agentId field (7358) added for unique identification,Enhanced identification capability,,agentId
deduction,field_change,agent,MarkLogic to MongDB Analyzer,model,model field renamed to modelDeploymentName,Structural rename with semantic preservation,model,modelDeploymentName
deduction,field_change,agent,MarkLogic to MongDB Analyzer,model,Model upgraded from gpt-4o to gpt-4.1,Potential behavioral variance in agent responses,gpt-4o,gpt-4.1
deduction,field_change,agent,MarkLogic to MongDB Analyzer,tools,tools array renamed to toolReferences,Low risk structural rename,tools,toolReferences
deduction,structural_analysis,agent,MarkLogic to MongDB Analyzer,task,Complete task object structure flattened into description field,Major structural simplification with potential metadata loss,task,description
deduction,missing_metadata,agent,MarkLogic to MongDB Analyzer,expectedOutput,expectedOutput specification with API cost tracking completely removed,Loss of validation enforcement and cost tracking capability,expectedOutput,
deduction,field_change,agent,MarkLogic to MongDB Plan,agentName,agentName field renamed to name,Minor structural change,agentName,name
deduction,field_change,agent,MarkLogic to MongDB Plan,agentId,New agentId field (7360) added for unique identification,Enhanced identification capability,,agentId
deduction,field_change,agent,MarkLogic to MongDB Plan,model,model field renamed to modelDeploymentName,Structural rename with semantic preservation,model,modelDeploymentName
deduction,field_change,agent,MarkLogic to MongDB Plan,model,Model upgraded from gpt-4o to gpt-4.1,Potential behavioral variance in agent responses,gpt-4o,gpt-4.1
deduction,field_change,agent,MarkLogic to MongDB Plan,tools,tools array renamed to toolReferences,Low risk structural rename,tools,toolReferences
deduction,structural_analysis,agent,MarkLogic to MongDB Plan,task,Complete task object structure flattened into description field,Major structural simplification with potential metadata loss,task,description
deduction,missing_metadata,agent,MarkLogic to MongDB Plan,expectedOutput,expectedOutput specification completely removed,Loss of validation enforcement and output contracts,expectedOutput,
deduction,governance_issue,workflow,,constraints,Systematic removal of expectedOutput across all agents weakens governance controls,Reduced auditability and validation enforcement
deduction,governance_issue,workflow,,validation,Loss of explicit output contracts reduces automated validation capability,Governance degradation
deduction,schema_evolution,workflow,,structure,Complete structural reorganization from flat to nested architecture,Breaking change requiring comprehensive migration
deduction,risk,agent,MarkLogic Documentation,model,Model upgrade may introduce response variations affecting downstream processing,Execution consistency risk
deduction,risk,agent,MarkLogic to MongDB Analyzer,expectedOutput,Loss of API cost tracking specification reduces financial monitoring capability,Cost management risk
deduction,risk,workflow,,migration,Complete structural reorganization requires coordinated migration across all dependent systems,High operational risk
deduction,risk,workflow,,validation,Removal of expectedOutput constraints reduces runtime validation capability,Quality assurance risk
deduction,ambiguity,workflow,,identification,Workflow ID changed from 1050 to 2624 without clear versioning rationale,Traceability concern
deduction,general_finding,workflow,,semantic_preservation,Core agent descriptions and instructions remain semantically identical,Strong functional continuity
deduction,general_finding,workflow,,model_consistency,Consistent model upgrade across all agents maintains execution environment uniformity,Operational consistency
deduction,general_finding,agent,MarkLogic Documentation,description,Agent description content preserved exactly maintaining functional specification,Perfect semantic preservation
deduction,general_finding,agent,MarkLogic to MongDB Analyzer,description,Agent description content preserved exactly maintaining functional specification,Perfect semantic preservation
deduction,general_finding,agent,MarkLogic to MongDB Plan,description,Agent description content preserved exactly maintaining functional specification,Perfect semantic preservation