Workflow Comparison Score,Total Agents Compared
78%,5

Agent Name,Agent Score,Risk Level,Key Score Drivers,Migration Action Required
DB2 to Oracle Converter,85%,Medium,Model changed from gpt-4o to gpt-4.1; maxExecutionTime added,Validate model compatibility and execution timeouts
DB2 to Oracle Unit Tester,82%,Medium,Model changed; expectedOutput format modified,Verify test framework compatibility
DB2 to Oracle Conversion Tester,82%,Medium,Model changed; expectedOutput format modified,Validate testing approach
DB2 to Oracle Recon Tester,82%,Medium,Model changed; expectedOutput format modified,Confirm reconciliation logic
DB2 to Oracle Reviewer,65%,Medium,Model changed from claude to gpt-4.1; LLM engine changed,Validate review quality with new model