Workflow Comparison Score,Total Agents Compared
78%,3

Agent Name,Agent Score,Risk Level,Key Score Drivers,Migration Action Required
DI AbInitio Documentation,85%,Low,"Model changed from claude-4-sonnet to gpt-4.1, role/goal/backstory removed, description significantly modified","Validate model behavior change and confirm instruction field removal"
DI AbInitio To PySpark Analyzer,92%,Low,"Description matched, LLM configs matched, tools matched","None - minimal changes detected"
DI AbInitio To PySpark Plan,71%,Medium,"Description matched, but agent ID changed from 3776 to 3647, maxExecutionTime reduced from 300 to 90","Validate runtime timeout reduction impact"