Workflow Comparison Score,Total Agents Compared
87.5,4

Agent Name,Agent Score,Risk Level,Key Score Drivers,Migration Action Required
Fabric Gold Model Logical,92.3,Low,"Model configs matched, description matched, LLM settings preserved",None
Fabric Gold Model Physical,89.2,Medium,"Model configs matched, description matched, embedding configs removed",Validate embedding functionality
DI Mermaid Data Model View,84.6,Medium,"Name normalized, description matched, task input reference changed",Update task input references
Fabric Gold Model Reviewer,84.6,Medium,"Description matched, model configs matched, embedding configs removed",Validate embedding functionality