Workflow Comparison Score,Total Agents Compared
67%,3

Agent Name,Agent Score,Risk Level,Key Score Drivers,Migration Action Required
DI BigQuery Silver DE Pipeline,58%,Medium,"role/goal/backstory removed, model changed gemini->gpt-4.1, LLM config restructured","Validate new model performance, confirm instruction field removal acceptable"
DI BigQuery Unit Test Case,72%,Medium,"role/goal/backstory removed, model changed gemini->gpt-4.1, tools structure changed","Validate new model performance, confirm instruction field removal acceptable"
DI BigQuery DE Pipeline Reviewer,71%,Medium,"role/goal/backstory removed, model changed gemini->gpt-4.1, embedding config removed","Validate new model performance, confirm instruction field removal acceptable"