Workflow Comparison Score,Total Agents Compared
76%,3

Agent Name,Agent Score,Risk Level,Key Score Drivers,Migration Action Required
DI Synapse SQL Documentation,68%,Medium,"role/goal/backstory removed, description masked, model configs matched","Validate instruction field removal impact, unmask description field"
DI Synapse To Lakeflow Analyzer,84%,Medium,"role/goal/backstory removed, description matched, model configs matched","Validate instruction field removal impact"
DI Synapse To Lakeflow Plan,84%,Medium,"role/goal/backstory removed, description matched, model configs matched","Validate instruction field removal impact"