Workflow Comparison Score,Total Agents Compared
78%,3

Agent Name,Agent Score,Risk Level,Key Score Drivers,Migration Action Required
SSIS Package Documentation,85%,Low,Description matched; model deployment changed from gpt-4o to gpt-4.1; role/goal/backstory removed,Validate model compatibility and confirm instruction field removal
SSIS Package to Python Analyzer,82%,Low,Description matched; model deployment changed from gpt-4o to gpt-4.1; role/goal/backstory removed,Validate model compatibility and confirm instruction field removal
SSIS Package to Python Plan,67%,Medium,Description matched; model changed from claude-3.7sonnet to gpt-4.1; embedding config removed; role/goal/backstory removed,Validate model change impact and confirm embedding removal