Workflow Comparison Score,Total Agents Compared
68%,3

Agent Name,Agent Score,Risk Level,Key Score Drivers,Migration Action Required
DI_SSIS_Documentation,0%,High Risk,Agent completely removed from AAVA 2.0,Confirm removal is acceptable or add missing agent
DI SSIS To DBTCloud Analyzer,85%,Medium Risk,"role/goal/backstory removed, maxIter/maxRpm nullified","Validate instruction field removal, confirm runtime parameter changes"
DI SSIS To DBTCloud Plan,85%,Medium Risk,"role/goal/backstory removed, maxIter/maxRpm nullified","Validate instruction field removal, confirm runtime parameter changes"