Workflow Comparison Score,Total Agents Compared
73%,3

Agent Name,Agent Score,Risk Level,Key Score Drivers,Migration Action Required
DI_SSIS_Documentation,0%,High,Agent completely removed from AAVA 2.0,Confirm agent removal is acceptable or add equivalent agent
DI SSIS To DBTCloud Analyzer,85%,Medium,Description matched but role/goal/backstory removed; maxExecutionTime reduced,Validate runtime behavior and confirm instruction field removal
DI SSIS To DBTCloud Plan,85%,Medium,Description matched but role/goal/backstory removed; maxExecutionTime reduced,Validate runtime behavior and confirm instruction field removal