Workflow Comparison Score,Total Agents Compared
78%,3

Agent Name,Agent Score,Risk Level,Key Score Drivers,Migration Action Required
DB2 DOCUMENTATION,85%,Medium,"Model changed (gpt-4o to gpt-4.1), role/goal/backstory removed, maxToken modified","Validate model behavior, confirm instruction field removal acceptable"
DB2 to Oracle Analyzer,75%,Medium,"Model changed (gpt-4o to gpt-4.1), role/goal/backstory removed, name normalized","Validate model behavior, confirm instruction field removal acceptable"
DB2 to Oracle Plan,74%,Medium,"Model changed (claude-3.7sonnet to gpt-4.1), role/goal/backstory removed","Validate model behavior and cross-platform compatibility"