section,category,entity,sub_entity,attribute,description,impact,aava1_ref,aava2_ref
summary,overall_score,workflow,,,72,,
summary,semantic_similarity,workflow,,,95,,
summary,structural_similarity,workflow,,,25,,
summary,governance_quality,workflow,,,75,,
summary,migration_readiness,workflow,,,Requires comprehensive structural migration with moderate risk,,
scoring,semantic_similarity,workflow,,,High semantic preservation across all agents with identical core functionality,,
scoring,structural_similarity,workflow,,,Major breaking reorganization from flat structure to nested containers,,
scoring,governance_quality,workflow,,,Mixed impact - improved agent identification but loss of explicit output constraints,,
scoring,overall,workflow,,,Balanced by strong semantic preservation despite structural changes,,
deduction,executive_summary,workflow,,,AAVA 2.0 introduces significant structural reorganization while maintaining core agent functionality,Requires coordinated migration effort,,
deduction,executive_summary,workflow,,,Breaking changes in workflow container structure and agent metadata organization,High migration complexity,,
deduction,executive_summary,workflow,,,Agent semantic roles preserved with enhanced identification but reduced constraint enforcement,Mixed governance impact,,
deduction,structural_analysis,workflow,,workflowId,Workflow identifier changed from workflowId to workFlowDetail.id,Breaking path change,workflowId,workFlowDetail.id
deduction,structural_analysis,workflow,,workflowName,Workflow name moved from root workflowName to workFlowDetail.name with format change,Path and format change,workflowName,workFlowDetail.name
deduction,structural_analysis,workflow,,container,Root nodes array replaced with workflowAgents container,Major structural reorganization,nodes,workflowAgents
deduction,structural_analysis,workflow,,nesting,Workflow metadata moved from flat structure to nested workFlowDetail container,Architectural change requiring path updates,,
deduction,agent_renamed,agent,DI_SAS_To_Python_Converter_PY_G,,Agent name preserved but container structure changed,Low semantic risk but structural impact,,
deduction,agent_renamed,agent,DI_SAS_To_Python_Reviewer,,Agent name preserved but container structure changed,Low semantic risk but structural impact,,
deduction,field_change,agent,DI_SAS_To_Python_Converter_PY_G,agentName,agentName field replaced with name field,Field rename requiring mapping,agentName,name
deduction,field_change,agent,DI_SAS_To_Python_Converter_PY_G,model,model field replaced with modelDeploymentName,Field rename with semantic enhancement,model,modelDeploymentName
deduction,field_change,agent,DI_SAS_To_Python_Converter_PY_G,tools,tools array replaced with toolReferences array,Field rename maintaining structure,tools,toolReferences
deduction,field_change,agent,DI_SAS_To_Python_Reviewer,agentName,agentName field replaced with name field,Field rename requiring mapping,agentName,name
deduction,field_change,agent,DI_SAS_To_Python_Reviewer,model,model field replaced with modelDeploymentName,Field rename with semantic enhancement,model,modelDeploymentName
deduction,field_change,agent,DI_SAS_To_Python_Reviewer,tools,tools array replaced with toolReferences array,Field rename maintaining structure,tools,toolReferences
deduction,agent_drift,agent,DI_SAS_To_Python_Converter_PY_G,agentId,New agentId field (7050) added for enhanced identification,Improved agent tracking and governance,,7050
deduction,agent_drift,agent,DI_SAS_To_Python_Reviewer,agentId,New agentId field (7079) added for enhanced identification,Improved agent tracking and governance,,7079
deduction,agent_drift,agent,DI_SAS_To_Python_Converter_PY_G,description,Task description moved from nested task.description to flat description field,Structural flattening with preserved content,task.description,description
deduction,agent_drift,agent,DI_SAS_To_Python_Reviewer,description,Task description moved from nested task.description to flat description field,Structural flattening with preserved content,task.description,description
deduction,missing_metadata,agent,DI_SAS_To_Python_Converter_PY_G,task,Complete task container structure removed,Loss of structured task definition,task,
deduction,missing_metadata,agent,DI_SAS_To_Python_Converter_PY_G,expectedOutput,Expected output specification completely removed,Loss of validation and governance enforcement,task.expectedOutput,
deduction,missing_metadata,agent,DI_SAS_To_Python_Reviewer,task,Complete task container structure removed,Loss of structured task definition,task,
deduction,missing_metadata,agent,DI_SAS_To_Python_Reviewer,expectedOutput,Expected output specification completely removed,Loss of validation and governance enforcement,task.expectedOutput,
deduction,type_change,agent,DI_SAS_To_Python_Converter_PY_G,model_value,Model specification changed from gemini-2.0-flash-001 to gpt-4.1,Potential behavior and capability variance,gemini-2.0-flash-001,gpt-4.1
deduction,type_change,agent,DI_SAS_To_Python_Reviewer,model_value,Model specification changed from gpt-4 to gpt-4.1,Minor version upgrade with potential behavior changes,gpt-4,gpt-4.1
deduction,constraint_change,agent,DI_SAS_To_Python_Converter_PY_G,tools_content,Tools specification changed from [FileWriterTool] to empty toolReferences,Loss of explicit tool capability definition,[FileWriterTool],[]
deduction,constraint_change,agent,DI_SAS_To_Python_Reviewer,tools_content,Tools specification changed from empty array to empty toolReferences,Consistent empty state maintained,[],[]
deduction,governance_issue,workflow,,expectedOutput,Removal of expectedOutput specifications weakens validation controls,Reduced auditability and enforcement capability,,
deduction,governance_issue,workflow,,task_structure,Removal of structured task containers reduces metadata richness,Loss of detailed agent specifications,,
deduction,governance_issue,agent,DI_SAS_To_Python_Converter_PY_G,validation,Loss of explicit output validation reduces quality assurance,Increased risk of output variance,,
deduction,governance_issue,agent,DI_SAS_To_Python_Reviewer,validation,Loss of explicit output validation reduces quality assurance,Increased risk of output variance,,
deduction,schema_evolution,workflow,,id_format,Workflow ID format changed from integer (2102) to nested structure (2599),Breaking change requiring ID resolution updates,2102,2599
deduction,schema_evolution,workflow,,name_format,Workflow name format changed from snake_case to space-separated,Cosmetic change with potential downstream impact,DI_SAS_To_Python_Converter_PY_G,DI SAS To Python Converter PY G
deduction,schema_evolution,workflow,,agent_container,Agent container evolution from simple array to structured workflowAgents,Architectural improvement requiring migration,,
deduction,schema_evolution,agent,,identification,Enhanced agent identification with explicit agentId fields,Improved traceability and governance,,
deduction,ambiguity,agent,DI_SAS_To_Python_Converter_PY_G,tools,Empty toolReferences despite description mentioning File Writer tool usage,Inconsistency between description and tool specification,,
deduction,ambiguity,workflow,,versioning,No explicit version indicators in either schema,Lack of schema version management,,
deduction,risk,workflow,,migration,Complete structural reorganization requires coordinated migration across all dependent systems,High operational risk and coordination complexity,,
deduction,risk,agent,DI_SAS_To_Python_Converter_PY_G,model_change,Model change from Gemini to GPT may affect output quality and behavior,Execution behavior variance risk,,
deduction,risk,agent,DI_SAS_To_Python_Converter_PY_G,tool_removal,Removal of explicit FileWriterTool reference may impact automation capability,Potential execution failure risk,,
deduction,risk,workflow,,validation,Loss of expectedOutput constraints reduces validation capability,Quality assurance degradation risk,,
deduction,risk,workflow,,governance,Structural changes may break existing governance and monitoring tools,Operational continuity risk,,
deduction,general_finding,workflow,,evolution,AAVA 2.0 represents architectural modernization with trade-offs,Balanced evolution with migration requirements,,
deduction,general_finding,agent,,preservation,Core agent functionality and semantic roles well preserved,Positive continuity maintenance,,
deduction,general_finding,workflow,,identification,Enhanced agent identification improves system observability,Positive governance enhancement,,
deduction,general_finding,workflow,,structure,Nested structure provides better organization but increases complexity,Mixed architectural impact,,