Workflow Comparison Score,Total Agents Compared
78.2,3

Agent Name,Agent Score,Risk Level,Key Score Drivers,Migration Action Required
Hive to Delta Documentation,82.1,Medium,"role/goal/backstory removed, model changed, maxExecutionTime added",Validate instruction completeness and runtime behavior
Hive to Delta Analyser,76.3,Medium,"role/goal/backstory removed, model changed, maxExecutionTime added",Validate instruction completeness and runtime behavior
Hive to Delta Plan,76.2,Medium,"role/goal/backstory removed, model changed, maxExecutionTime added",Validate instruction completeness and runtime behavior