Workflow Comparison Score,Total Agents Compared
82.3,3

Agent Name,Agent Score,Risk Level,Key Score Drivers,Migration Action Required
Hive to Delta Documentation,85.7,Medium,Model deployment changed gpt-4o to gpt-4.1; role/goal/backstory removed; description matched,Validate model compatibility and confirm instruction field removal
Hive to Delta Analyser,82.1,Medium,Model deployment changed gpt-4o to gpt-4.1; role/goal/backstory removed; description matched,Validate model compatibility and confirm instruction field removal
Hive to Delta Plan,79.2,Medium,Model deployment changed gpt-4o to gpt-4.1; role/goal/backstory removed; description matched,Validate model compatibility and confirm instruction field removal