Workflow Comparison Score,Total Agents Compared
85.2,3

Agent Name,Agent Score,Risk Level,Key Score Drivers,Migration Action Required
Hive to Delta Documentation,88.5,Low,"Model deployment changed, description matched, LLM configs mostly preserved",Validate new model deployment compatibility
Hive to Delta Analyser,84.2,Medium,"Role/goal/backstory removed, model changed, core logic preserved",Review instruction completeness and model behavior
Hive to Delta Plan,83.0,Medium,"Model deployment changed, instruction fields removed, runtime configs preserved",Validate model compatibility and instruction adequacy