section,category,entity,sub_entity,attribute,description,impact,aava1_ref,aava2_ref
summary,overall_score,workflow,,,72,
summary,semantic_similarity,workflow,,,85,
summary,structural_similarity,workflow,,,45,
summary,governance_quality,workflow,,,75,
summary,migration_readiness,workflow,,,Requires comprehensive structural migration,
scoring,semantic_similarity,workflow,,,High semantic preservation across all agents with identical core functionality,
scoring,structural_similarity,workflow,,,Major breaking reorganization with container restructuring and field relocations,
scoring,governance_quality,workflow,,,Mixed impact with enhanced agent identification but loss of explicit output expectations,
scoring,overall,workflow,,,Balanced by strong semantic preservation despite structural changes,
deduction,executive_summary,workflow,,,AAVA 2.0 introduces breaking structural changes while preserving core agent semantics and functionality,High migration effort required with coordinated system updates,
deduction,executive_summary,workflow,,,All three agents maintain identical business logic and processing capabilities,Low execution risk post-migration,
deduction,executive_summary,workflow,,,Workflow container restructuring requires orchestration system updates,Breaking change impact on dependent systems,
deduction,structural_analysis,workflow,,workflowId,Workflow identifier moved from root level to nested workFlowDetail.id container,Breaking path change requiring system updates,workflowId,workFlowDetail.id
deduction,structural_analysis,workflow,,workflowName,Workflow name moved from root level to nested workFlowDetail.name container,Breaking path change requiring system updates,workflowName,workFlowDetail.name
deduction,schema_evolution,workflow,,nodes,Root-level nodes array completely restructured to workflowAgents container,Major orchestration system impact requiring agent discovery logic updates,nodes,workflowAgents
deduction,agent_renamed,agent,Talend_to_PySpark_Documentation,,Agent name preserved with enhanced semantic clarity through consistent naming,Low semantic risk with improved readability,
deduction,agent_renamed,agent,Talend_to_PySpark_Analyzer,,Agent name preserved with enhanced semantic clarity through consistent naming,Low semantic risk with improved readability,
deduction,agent_renamed,agent,Talend_to_PySpark_Plan,,Agent name preserved with enhanced semantic clarity through consistent naming,Low semantic risk with improved readability,
deduction,field_change,agent,Talend_to_PySpark_Documentation,agentName,Agent identifier changed from agentName to name for improved clarity,Low risk field rename,agentName,name
deduction,field_change,agent,Talend_to_PySpark_Documentation,model,Model specification changed from model to modelDeploymentName for deployment clarity,Potential deployment configuration impact,model,modelDeploymentName
deduction,field_change,agent,Talend_to_PySpark_Documentation,tools,Tools specification changed from tools to toolReferences for enhanced referential integrity,Low risk rename with improved semantics,tools,toolReferences
deduction,missing_metadata,agent,Talend_to_PySpark_Documentation,task,Task container structure flattened with task.description moved to description field,Reduced metadata hierarchy and potential loss of task-level metadata,task,description
deduction,missing_metadata,agent,Talend_to_PySpark_Documentation,expectedOutput,Expected output specification completely removed from agent definition,Loss of validation enforcement and output contract clarity,task.expectedOutput,
deduction,field_change,agent,Talend_to_PySpark_Documentation,agentId,New agent identifier field added for enhanced agent tracking and referencing,,agentId
deduction,field_change,agent,Talend_to_PySpark_Analyzer,agentName,Agent identifier changed from agentName to name for improved clarity,Low risk field rename,agentName,name
deduction,field_change,agent,Talend_to_PySpark_Analyzer,model,Model specification changed from model to modelDeploymentName for deployment clarity,Potential deployment configuration impact,model,modelDeploymentName
deduction,field_change,agent,Talend_to_PySpark_Analyzer,tools,Tools specification changed from tools to toolReferences for enhanced referential integrity,Low risk rename with improved semantics,tools,toolReferences
deduction,missing_metadata,agent,Talend_to_PySpark_Analyzer,task,Task container structure flattened with task.description moved to description field,Reduced metadata hierarchy and potential loss of task-level metadata,task,description
deduction,missing_metadata,agent,Talend_to_PySpark_Analyzer,expectedOutput,Expected output specification completely removed from agent definition,Loss of validation enforcement and output contract clarity,task.expectedOutput,
deduction,field_change,agent,Talend_to_PySpark_Analyzer,agentId,New agent identifier field added for enhanced agent tracking and referencing,,agentId
deduction,field_change,agent,Talend_to_PySpark_Plan,agentName,Agent identifier changed from agentName to name for improved clarity,Low risk field rename,agentName,name
deduction,field_change,agent,Talend_to_PySpark_Plan,model,Model specification changed from model to modelDeploymentName for deployment clarity,Potential deployment configuration impact,model,modelDeploymentName
deduction,field_change,agent,Talend_to_PySpark_Plan,tools,Tools specification changed from tools to toolReferences for enhanced referential integrity,Low risk rename with improved semantics,tools,toolReferences
deduction,missing_metadata,agent,Talend_to_PySpark_Plan,task,Task container structure flattened with task.description moved to description field,Reduced metadata hierarchy and potential loss of task-level metadata,task,description
deduction,missing_metadata,agent,Talend_to_PySpark_Plan,expectedOutput,Expected output specification completely removed from agent definition,Loss of validation enforcement and output contract clarity,task.expectedOutput,
deduction,field_change,agent,Talend_to_PySpark_Plan,agentId,New agent identifier field added for enhanced agent tracking and referencing,,agentId
deduction,governance_issue,workflow,,expectedOutput,Systematic removal of expectedOutput specifications across all agents weakens governance controls,Reduced validation enforceability and output contract clarity,
deduction,governance_issue,workflow,,task_structure,Flattening of task container structure reduces metadata hierarchy and organizational clarity,Potential loss of task-level governance and metadata organization,
deduction,schema_evolution,workflow,,agent_identification,Introduction of agentId fields enhances agent tracking and referential integrity,Improved agent management and system integration capabilities,
deduction,schema_evolution,workflow,,model_deployment,Enhanced model specification through modelDeploymentName provides clearer deployment context,Improved deployment configuration and model management,
deduction,risk,workflow,,migration,Complete structural reorganization requires coordinated migration across all dependent systems,High operational risk requiring comprehensive migration planning,
deduction,risk,workflow,,orchestration,Agent container restructuring may break existing orchestration and discovery logic,Execution failure risk in dependent systems until migration completion,
deduction,risk,agent,Talend_to_PySpark_Documentation,validation,Loss of expectedOutput specification reduces runtime validation capabilities,Potential execution errors due to undefined output contracts,
deduction,risk,agent,Talend_to_PySpark_Analyzer,validation,Loss of expectedOutput specification reduces runtime validation capabilities,Potential execution errors due to undefined output contracts,
deduction,risk,agent,Talend_to_PySpark_Plan,validation,Loss of expectedOutput specification reduces runtime validation capabilities,Potential execution errors due to undefined output contracts,
deduction,general_finding,workflow,,backward_compatibility,AAVA 2.0 introduces breaking changes that prevent backward compatibility with AAVA 1.0 systems,Requires comprehensive migration strategy and coordinated system updates,
deduction,general_finding,workflow,,semantic_preservation,Core agent functionality and business logic remain fully preserved across all agents,Strong semantic continuity ensures consistent processing capabilities post-migration,