Workflow Comparison Score,Total Agents Compared
78%,3

Agent Name,Agent Score,Risk Level,Key Score Drivers,Migration Action Required
DI BigQuery Gold Aggregated DE Pipeline,75%,Medium,"model changed (gemini-2.5-pro to gpt-4.1), role/goal/backstory removed, tools removed","Validate model compatibility and confirm instruction field removal"
DI BigQuery Unit Test Case,82%,Medium,"model changed (gemini-2.5-pro to gpt-4.1), role/goal/backstory removed, tools removed","Validate model compatibility and confirm instruction field removal"
DI BigQuery DE Pipeline Reviewer,77%,Medium,"model changed (gemini-2.5-pro to gpt-4.1), role/goal/backstory removed, embedding removed","Validate model compatibility and confirm instruction field removal"