section,category,entity,sub_entity,attribute,description,impact,aava1_ref,aava2_ref
summary,overall_score,workflow,,,62,
summary,semantic_similarity,workflow,,,85,
summary,structural_similarity,workflow,,,25,
summary,governance_quality,workflow,,,75,
summary,migration_readiness,workflow,,,Requires comprehensive structural migration,
scoring,semantic_similarity,workflow,,,High semantic preservation - core agent functionality maintained with identical task description,
scoring,structural_similarity,workflow,,,Major breaking reorganization - complete container restructuring and field relocations,
scoring,governance_quality,workflow,,,Significant governance degradation due to expectedOutput removal,
scoring,overall,workflow,,,Balanced by semantic preservation but hindered by structural breaking changes,
deduction,executive_summary,workflow,,,AAVA 2.0 introduces major structural reorganization while preserving core semantic functionality,High migration complexity required,
deduction,executive_summary,workflow,,,Breaking changes in workflow container structure and agent organization,Requires coordinated migration effort,
deduction,executive_summary,workflow,,,Loss of expectedOutput specification reduces validation enforceability,Governance quality degradation,
deduction,executive_summary,workflow,,,Model upgrade from gpt-4 to gpt-4.1 may introduce behavioral variance,Potential execution differences,
deduction,structural_analysis,workflow,,workflowId,Workflow identifier changed from 1032 to 1920,Breaking change requiring system updates,workflowId,workFlowDetail.id
deduction,structural_analysis,workflow,,workflowName,Workflow name modified with spacing changes,Minor presentation impact,workflowName,workFlowDetail.name
deduction,structural_analysis,workflow,,container,Root-level workflow metadata moved to workFlowDetail container,Breaking structural reorganization,root,workFlowDetail
deduction,structural_analysis,workflow,,nodes,nodes array renamed to workflowAgents,Breaking orchestration change,nodes,workflowAgents
deduction,schema_evolution,workflow,,structure,Complete workflow structure reorganization from flat to nested,Major migration complexity,flat_structure,nested_structure
deduction,agent_renamed,agent,DI_Oracle_to_Snowflake_Data_Model_Consolidation,agentName,Agent name preserved with minor spacing adjustment,Low semantic risk,agentName,name
deduction,agent_drift,agent,DI_Oracle_to_Snowflake_Data_Model_Consolidation,id,Agent identifier added as agentId field,New tracking capability,none,agentId
deduction,agent_drift,agent,DI_Oracle_to_Snowflake_Data_Model_Consolidation,model,Model upgraded from gpt-4 to gpt-4.1,Potential behavioral variance,gpt-4,gpt-4.1
deduction,agent_drift,agent,DI_Oracle_to_Snowflake_Data_Model_Consolidation,task,Task container structure flattened - description moved to root level,Structural simplification,task.description,description
deduction,field_change,agent,DI_Oracle_to_Snowflake_Data_Model_Consolidation,tools,tools array renamed to toolReferences,Low risk semantic rename,tools,toolReferences
deduction,missing_metadata,agent,DI_Oracle_to_Snowflake_Data_Model_Consolidation,expectedOutput,Expected output specification completely removed,Critical governance loss,task.expectedOutput,none
deduction,field_change,workflow,,workflowId,Workflow ID relocated from root to nested container,Breaking path change,workflowId,workFlowDetail.id
deduction,field_change,workflow,,workflowName,Workflow name relocated from root to nested container,Breaking path change,workflowName,workFlowDetail.name
deduction,field_change,workflow,,nodes,Agent collection renamed and relocated,Breaking orchestration change,nodes,workflowAgents
deduction,type_change,agent,DI_Oracle_to_Snowflake_Data_Model_Consolidation,model,Model field renamed to modelDeploymentName,Semantic clarification,model,modelDeploymentName
deduction,constraint_change,agent,DI_Oracle_to_Snowflake_Data_Model_Consolidation,expectedOutput,Removal of explicit output expectations,Loss of validation constraints,task.expectedOutput,none
deduction,governance_issue,workflow,,validation,Removal of expectedOutput weakens validation framework,Reduced auditability and compliance,
deduction,governance_issue,agent,DI_Oracle_to_Snowflake_Data_Model_Consolidation,constraints,Loss of explicit output format specification,Weakened execution governance,
deduction,governance_issue,workflow,,traceability,Structural reorganization impacts metadata traceability,Audit trail complexity,
deduction,ambiguity,agent,DI_Oracle_to_Snowflake_Data_Model_Consolidation,output,No explicit output format specification in AAVA 2.0,Execution ambiguity risk,
deduction,risk,agent,DI_Oracle_to_Snowflake_Data_Model_Consolidation,model,Model version upgrade may alter response patterns,Behavioral consistency risk,gpt-4,gpt-4.1
deduction,risk,workflow,,migration,Complete structural reorganization requires coordinated system migration,High operational risk,
deduction,risk,agent,DI_Oracle_to_Snowflake_Data_Model_Consolidation,validation,Loss of expectedOutput reduces runtime validation capability,Execution quality risk,
deduction,risk,workflow,,compatibility,Breaking changes in core workflow structure,Backward compatibility failure,
deduction,general_finding,workflow,,evolution,AAVA 2.0 represents significant architectural evolution,Modernization with migration cost,
deduction,general_finding,agent,DI_Oracle_to_Snowflake_Data_Model_Consolidation,preservation,Core agent functionality semantically preserved,Continuity maintained,
deduction,general_finding,workflow,,governance,Mixed governance impact - improved structure but reduced constraints,Balanced governance evolution,
deduction,general_finding,workflow,,readiness,Requires comprehensive migration planning and testing,Production readiness assessment needed,