Workflow Comparison Score,Total Agents Compared
72%,5

Agent Name,Agent Score,Risk Level,Key Score Drivers,Migration Action Required
DI SQL Server To Snowflake Converter,78%,Medium,"role/goal/backstory removed, model config matched",Validate instruction field behavior
DI SQL Server To Snowflake Unit Test,65%,Medium,"role/goal/backstory removed, description masked",Add missing fields or confirm deprecation
DI SQL Server To Snowflake Conversion Tester,78%,Medium,"role/goal/backstory removed, model config matched",Validate instruction field behavior
DI SQL Server To Snowflake Reconciliation,65%,Medium,"role/goal/backstory removed, description masked",Add missing fields or confirm deprecation
DI SQL Server To Snowflake Reviewer,72%,Medium,"role/goal/backstory removed, model changed to Bedrock",Validate runtime behavior