Workflow Comparison Score,Total Agents Compared
76%,5

Agent Name,Agent Score,Risk Level,Key Score Drivers,Migration Action Required
ABAP to PySpark Converter,85%,Low,Model deployment changed from o3-mini to gpt-4.1; description matched; core configs preserved,Validate new model performance
ABAP to PySpark Unit Testing,78%,Medium,Model changed from gpt-4o to gpt-4.1; maxIter removed; role/goal/backstory removed,Confirm maxIter removal impact and validate model change
ABAP to PySpark Conversion Tester,72%,Medium,Model changed from gpt-4o to gpt-4.1; role/goal/backstory removed; core logic preserved,Validate model performance and confirm instruction removal
ABAP To PySpark Recon Tester,74%,Medium,Model changed from gpt-4o to gpt-4.1; role/goal/backstory removed; maxExecutionTime added,Validate new execution timeout and model change
ABAP To PySpark Reviewer,76%,Medium,Model changed from gpt-4o to gpt-4.1; maxIter removed; role/goal/backstory removed,Confirm maxIter removal and validate model performance