Workflow Comparison Score,Total Agents Compared
85%,3

Agent Name,Agent Score,Risk Level,Key Score Drivers,Migration Action Required
Postgres Documentation,87%,Low,Model deployment changed from gpt-4o to gpt-4.1; role/goal/backstory removed; maxIter/maxRpm set to null,Validate model behavior and confirm instruction field removal
Postgres to PySpark Analyzer,87%,Low,Model deployment changed from gpt-4o to gpt-4.1; role/goal/backstory removed; maxIter/maxRpm set to null,Validate model behavior and confirm instruction field removal
Postgres to PySpark Plan,83%,Low,Model deployment changed from gpt-4o to gpt-4.1; role/goal/backstory removed; maxIter/maxRpm set to null,Validate model behavior and confirm instruction field removal