Workflow Comparison Score,Total Agents Compared
83%,3

Agent Name,Agent Score,Risk Level,Key Score Drivers,Migration Action Required
Postgres Documentation,85%,Medium,"role/goal/backstory removed, model changed, description matched","Validate removal of instruction fields, confirm model deployment change"
Postgres to PySpark Analyzer,82%,Medium,"role/goal/backstory removed, model changed, description matched","Validate removal of instruction fields, confirm model deployment change"
Postgres to PySpark Plan,82%,Medium,"role/goal/backstory removed, model changed, description matched","Validate removal of instruction fields, confirm model deployment change"