Workflow Comparison Score,Total Agents Compared
85.3,3

Agent Name,Agent Score,Risk Level,Key Score Drivers,Migration Action Required
Postgres Documentation,89.2,Low,"Model deployment changed, description matched, LLM configs matched",Validate model deployment compatibility
Postgres to PySpark Analyzer,87.5,Medium,"Model deployment changed, role/goal/backstory removed, description matched",Validate agent behavior without role/goal/backstory
Postgres to PySpark Plan,79.2,Medium,"Model deployment changed, role/goal/backstory removed, maxExecutionTime added",Validate runtime behavior and execution limits