Workflow Comparison Score,Total Agents Compared
78%,3

Agent Name,Agent Score,Risk Level,Key Score Drivers,Migration Action Required
DI SSIS Documentation,85%,Low,"model configs matched, description matched, temperature matched, topP matched, maxToken matched",Validate expectedOutput format change from task.expectedOutput to agentDetails.expectedOutputFormat
DI SSIS to PySpark Analyzer,75%,Medium,"model configs matched, description matched, but role/goal/backstory removed, maxIter changed from 15 to null",Add missing role/goal/backstory fields and validate maxIter null handling
DI SSIS to PySpark Plan,72%,Medium,"model configs matched, description matched, but role/goal/backstory removed, maxIter changed from 15 to null",Add missing role/goal/backstory fields and validate maxIter null handling