Workflow Comparison Score,Total Agents Compared
76%,5

Agent Name,Agent Score,Risk Level,Key Score Drivers,Migration Action Required
ABAP to PySpark Converter,85%,Low,Model changed from o3-mini to gpt-4.1; role/goal/backstory removed; description matched,Validate new model performance and confirm instruction field removal
ABAP to PySpark Unit Testing,78%,Medium,Model changed from gpt-4o to gpt-4.1; role/goal/backstory removed; maxIter removed,Validate model compatibility and test iteration behavior
ABAP to PySpark Conversion Tester,75%,Medium,Model changed from gpt-4o to gpt-4.1; role/goal/backstory removed; description matched,Validate new model performance and confirm instruction field removal
ABAP To PySpark Recon Tester,75%,Medium,Model changed from gpt-4o to gpt-4.1; role/goal/backstory removed; description matched,Validate new model performance and confirm instruction field removal
ABAP To PySpark Reviewer,72%,Medium,Model changed from gpt-4o to gpt-4.1; role/goal/backstory removed; maxIter removed,Validate model compatibility and test iteration behavior