section,category,entity,sub_entity,attribute,description,impact,aava1_ref,aava2_ref
summary,overall_score,workflow,,,77,,
summary,semantic_similarity,workflow,,,85,,
summary,structural_similarity,workflow,,,25,,
summary,governance_quality,workflow,,,70,,
summary,migration_readiness,workflow,,,Requires comprehensive migration,,
scoring,semantic_similarity,workflow,,,High semantic preservation across all agents,,
scoring,structural_similarity,workflow,,,Major breaking reorganization due to container restructuring,,
scoring,governance_quality,workflow,,,Loss of expectedOutput constraints reduces validation enforceability,,
scoring,overall,workflow,,,Balanced by high correctness and semantic preservation despite structural changes,,
deduction,executive_summary,workflow,,,AAVA 2.0 introduces breaking structural changes while preserving core agent semantics,High migration effort required,,
deduction,structural_analysis,workflow,,workflowId,Workflow identifier moved from root pipeline to nested workFlowDetail container,Breaking path change,pipeline.pipelineId,data.workFlowDetail.id
deduction,structural_analysis,workflow,,container,Pipeline container renamed to workFlowDetail with nested structure,Requires orchestration updates,pipeline,data.workFlowDetail
deduction,structural_analysis,workflow,,agents,Agent container renamed from pipeLineAgents to workflowAgents,Breaking container change,pipeline.pipeLineAgents,data.workFlowDetail.workflowAgents
deduction,agent_renamed,agent,DI_Token_Size_Estimator_S3_IMS,,Agent renamed to DI Token Size Estimator S3 IMS HP with preserved semantic role,Low semantic risk,,
deduction,agent_renamed,agent,DI_Pagewise_TML_To_CSV_Converter_S3_IMS,,Agent renamed to DI Pagewise TML To CSV Converter S3 IMS HP with preserved semantic role,Low semantic risk,,
deduction,agent_renamed,agent,DI_ThoughtSpotSQL_To_Lvdashboard_Converter_S3_IMS,,Agent renamed to DI ThoughtSpotSQL To Lvdashboard Converter S3 IMS HP with preserved semantic role,Low semantic risk,,
deduction,agent_renamed,agent,DI_PageWise_ThoughtSpotSQL_To_Individual_Lvdashboard_Creator_S3_IMS,,Agent renamed to DI PageWise ThoughtSpotSQL To Individual Lvdashboard Creator S3 IMS HP Clone with preserved semantic role,Low semantic risk,,
deduction,agent_renamed,agent,DI_Pagewise_Thoughspot_Json_Merger_S3_IMS,,Agent renamed to DI Pagewise Thoughspot Json Merger S3 IMS HP Clone with preserved semantic role,Low semantic risk,,
deduction,field_change,agent,DI_Token_Size_Estimator_S3_IMS,id,Agent id field moved from root to agentId within workflowAgents structure,Structural reorganization,agent.id,agentId
deduction,field_change,agent,DI_Token_Size_Estimator_S3_IMS,name,Agent name field moved from root to name within workflowAgents structure,Structural reorganization,agent.name,name
deduction,missing_metadata,agent,DI_Token_Size_Estimator_S3_IMS,role,Agent role field removed in AAVA 2.0,Loss of role specification,,
deduction,missing_metadata,agent,DI_Token_Size_Estimator_S3_IMS,goal,Agent goal field removed in AAVA 2.0,Loss of goal specification,,
deduction,missing_metadata,agent,DI_Token_Size_Estimator_S3_IMS,backstory,Agent backstory field removed in AAVA 2.0,Loss of context information,,
deduction,missing_metadata,agent,DI_Token_Size_Estimator_S3_IMS,verbose,Agent verbose field removed in AAVA 2.0,Loss of verbosity control,,
deduction,missing_metadata,agent,DI_Token_Size_Estimator_S3_IMS,allowDelegation,Agent allowDelegation field removed in AAVA 2.0,Loss of delegation control,,
deduction,missing_metadata,agent,DI_Token_Size_Estimator_S3_IMS,updatedAt,Agent updatedAt field removed in AAVA 2.0,Loss of timestamp tracking,,
deduction,field_change,agent,DI_Token_Size_Estimator_S3_IMS,llm,LLM configuration restructured to modelDeploymentName and modelName,Configuration reorganization,agent.llm,modelDeploymentName
deduction,missing_metadata,agent,DI_Token_Size_Estimator_S3_IMS,task.expectedOutput,Expected output specification removed,Loss of validation enforcement,,
deduction,field_change,agent,DI_Token_Size_Estimator_S3_IMS,task.description,Task description moved to description field,Field relocation,agent.task.description,description
deduction,field_change,agent,DI_Token_Size_Estimator_S3_IMS,maxIter,MaxIter moved to agentDetails.maxIter,Configuration reorganization,agent.maxIter,agentDetails.maxIter
deduction,field_change,agent,DI_Token_Size_Estimator_S3_IMS,maxRpm,MaxRpm moved to agentDetails.maxRpm,Configuration reorganization,agent.maxRpm,agentDetails.maxRpm
deduction,field_change,agent,DI_Token_Size_Estimator_S3_IMS,maxExecutionTime,MaxExecutionTime moved to agentDetails.maxExecutionTime,Configuration reorganization,agent.maxExecutionTime,agentDetails.maxExecutionTime
deduction,field_change,agent,DI_Token_Size_Estimator_S3_IMS,tools,Tools field renamed to toolReferences in agentDetails,Low risk rename,agent.tools,agentDetails.toolReferences
deduction,missing_metadata,agent,DI_Token_Size_Estimator_S3_IMS,userTools,UserTools field removed in AAVA 2.0,Loss of custom tool definitions,,
deduction,field_change,agent,DI_Token_Size_Estimator_S3_IMS,allowCodeExecution,AllowCodeExecution moved to agentDetails.allowCodeExecution,Configuration reorganization,agent.allowCodeExecution,agentDetails.allowCodeExecution
deduction,field_change,agent,DI_Token_Size_Estimator_S3_IMS,isSafeCodeExecution,IsSafeCodeExecution moved to agentDetails.isSafeCodeExecution,Configuration reorganization,agent.isSafeCodeExecution,agentDetails.isSafeCodeExecution
deduction,governance_issue,workflow,,constraints,Removal of expectedOutput weakens governance controls,Reduced auditability,,
deduction,governance_issue,workflow,,validation,Loss of userTools definitions reduces custom validation capability,Reduced extensibility,,
deduction,risk,workflow,,migration,Complete structural reorganization requires coordinated migration,High operational risk,,
deduction,risk,agent,DI_Token_Size_Estimator_S3_IMS,tools,UserTools removal may reduce automation capability,Execution failure risk,,
deduction,schema_evolution,workflow,,structure,Major container restructuring from pipeline to workFlowDetail,Breaking schema change,pipeline,data.workFlowDetail
deduction,schema_evolution,workflow,,agents,Agent array restructuring with new field organization,Breaking agent schema change,pipeLineAgents,workflowAgents
deduction,constraint_change,agent,DI_Token_Size_Estimator_S3_IMS,configuration,Agent configuration fields moved to nested agentDetails structure,Configuration access change,,agentDetails
deduction,type_change,agent,DI_Token_Size_Estimator_S3_IMS,llm,LLM configuration simplified from complex object to simple string references,Type simplification,agent.llm,modelDeploymentName
deduction,ambiguity,workflow,,versioning,No explicit versioning strategy defined for migration,Migration planning risk,,
deduction,general_finding,workflow,,compatibility,Backward compatibility broken due to structural changes,Integration failure risk,,
deduction,general_finding,workflow,,governance,Governance model simplified but enforcement capability reduced,Mixed governance impact,,
deduction,general_finding,agent,All_Agents,naming,All agents follow consistent HP naming convention in AAVA 2.0,Improved naming consistency,,
deduction,general_finding,agent,All_Agents,structure,All agents follow consistent agentDetails nested structure in AAVA 2.0,Improved structural consistency,,
deduction,general_finding,workflow,,metadata,Workflow metadata organization improved with cleaner separation,Improved organization,,