Workflow Comparison Score,Total Agents Compared
82%,5

Agent Name,Agent Score,Risk Level,Key Score Drivers,Migration Action Required
DI SAS To PySpark Converter,88%,Medium,"Role/goal/backstory removed, description matched, LLM configs matched",Validate instruction field removal impact
DI SAS To PySpark UnitTest,85%,Medium,"Role/goal/backstory removed, description matched, LLM configs matched",Validate instruction field removal impact
DI SAS To PySpark ConversionTester,82%,Medium,"Role/goal/backstory removed, description modified, model changed",Validate model change and instruction updates
DI SAS To PySpark Recon Tester,78%,Medium,"Role/goal/backstory removed, description matched, model configs matched",Validate instruction field removal impact
DI SAS To PySpark Reviewer,77%,Medium,"Role/goal/backstory removed, description matched, model configs matched",Validate instruction field removal impact