Workflow Comparison Score,Total Agents Compared
78%,3

Agent Name,Agent Score,Risk Level,Key Score Drivers,Migration Action Required
DI ECL Documentation JSON,85%,Low,Model changed from gpt-4o to gpt-4.1; role/goal/backstory removed; description matched,Validate model behavior and confirm instruction field removal
DI ECL Analyser JSON,78%,Medium,Model changed from gpt-4o to gpt-4.1; role/goal/backstory removed; description matched,Validate model behavior and confirm instruction field removal
DI ECL Plan JSON,71%,Medium,Model changed from gpt-4o to gpt-4.1; role/goal/backstory removed; description matched,Validate model behavior and confirm instruction field removal