Workflow Comparison Score,Total Agents Compared
78%,3

Agent Name,Agent Score,Risk Level,Key Score Drivers,Migration Action Required
DI_AbInitio_Documentation,72%,Medium,"Model changed from claude-4-sonnet to gpt-4.1, role/goal/backstory removed, maxToken reduced",Validate model performance and add missing instruction fields
DI_AbInitio_To_BigQuery_Analyzer,84%,Medium,"Model changed from gemini-2.5-pro to gpt-4.1, role/goal/backstory removed",Validate model performance and add missing instruction fields
DI_AbInitio_To_BigQuery_Plan,78%,Medium,"Model changed from gpt-4 to gpt-4.1, role/goal/backstory removed",Validate model performance and add missing instruction fields