Workflow Comparison Score,Total Agents Compared
86%,3

Agent Name,Agent Score,Risk Level,Key Score Drivers,Migration Action Required
T-SQL Server Documentation,92%,Low,"model deployment changed, minor field restructuring",Validate model compatibility
T-SQL Server to PySpark Analyzer,88%,Medium,"agent name normalized, model deployment changed",Validate model compatibility and name consistency
T-SQL Server to PySpark Plan,78%,Medium,"model deployment changed, field restructuring",Validate model compatibility and runtime configuration